usRanking,previousRank,clubId,clubName,name,city,state,courseType,panelistCount,starRating,in100Greatest,in100GreatestPublic,bestInState,description,designers,yearOpened,notableHistory,majorTournaments,address,phone,website,par,yardage,notes
47,55,,,Shoreacres,Lake Bluff,IL,Private,43,4.5,true,false,true,Shoreacres possesses perhaps the most fascinating topography upon which Seth Raynor ever created a golf course, a remarkable assertion given that most of the playing surfaces are dead flat, though the in-between spaces are cut through by winding depressions and several deep ravines. Raynor infused the design with his usual collection of suspects, including No. 3 (Leven), No. 6 (Biarritz), No. 7 (Double Plateau), No. 8 (Eden), No. 10 (one of the best Road Hole interpretations in the U.S.) and No. 14 (Redan) all playing along the plateaus that edge the gulleys and ravines that feed into Lake Michigan. The stretch of 11, 12 and 13, playing across a ravine, down into it, and back out of it with a blind tee shot, are as unique a stretch of holes as can be found anywhere on a 100 Greatest course. The tight turf, rivaling the firmest conditions of any parkland course, add to the challenge, and when playing as fiery as usual, shots played into the sensuously bubbled greens often have to be landed 10 or 15 yards short to be played onto the putting surfaces.,Seth Raynor,,Fascinating topography with template holes. Firmest turf of any parkland course. Holes 11-13 unique stretch.,,,,,,Template holes along Lake Michigan plateaus
48,47,,,Camargo Club,Cincinnati,OH,Private,20,5,true,false,true,One of Seth Raynor's last designs, Camargo Club wasn't completed until nearly a year after his 1926 death. William Jackson, who later became the club's pro and superintendent, handled the construction and was faithful to Raynor's diagrams with two exceptions: He turned the 16th into a par 4 and the 17th into a par 5. Robert von Hagge added flashy but incongruous bunkering in the early 1960s. They lasted over 20 years, until Tom Doak undertook a restoration in the Raynor style of geometric-shaped bunkers and greens. Curiously, the Biarritz green at the par-3 eighth has never been mowed, as the 60-yard-long putting surface found on other Biarritz holes built by Raynor or his mentor C.B. Macdonald. Club officials insisted early aerial photos confirm the front half of the green was always mown at fairway height, so they continue that tradition today. Don Placek of Renaissance Golf has recently completed further renovation enhancements, including adding six acres of restored fairway to better help define the scale of the property and extending the back left section of the Road green at 17 (as well as reintroducing a second Road bunker beyond the first) to reclaim its original prodigious 15,000 square feet.,Seth Raynor; William Jackson; Robert von Hagge; Tom Doak (restoration); Don Placek (renovation),1926,Raynor died before completion (1926). William Jackson faithful to plans. Doak restored Raynor style. Placek recent enhancements.,,,,,,Biarritz green never fully mowed
49,48,,,Erin Hills Golf Course,Hartford,WI,Public,44,4.5,true,true,true,Despite the rumor, Erin Hills wasn't designed specifically to host a U.S. Open. Its original concept was to be a simple, affordable, lay-of-the-land layout to prove Mother Nature is indeed the best golf architect. The concept changed—some greens moved, one blind par 3 eliminated—as the quest for a U.S. Open grew. That dream came true: after trial runs hosting the 2008 U.S. Women's Public Links and the 2011 U.S. Amateur, Erin Hills hosted the U.S. Open in 2017, the first time the event had ever been in Wisconsin. Brooks Koepka won with a 72-hole score of 16-under, leading some to conclude Erin Hills was too wide and defenseless. In truth, what it lacked that week was the usual gusty winds that would have effectively narrowed the slanted, canted fairways. Had the par been adjusted to 70 instead of 72 as is usual for most Opens, the score would likely have been closer to 8-under.,Michael Hurdzan; Dana Fry; Ron Whitten,,Original concept: affordable lay-of-the-land. Hosted U.S. Open 2017 (Brooks Koepka, 16-under).,U.S. Women's Public Links 2008; U.S. Amateur 2011; U.S. Open 2017 (Brooks Koepka),,,,,Wide fairways need wind for defense
50,46,,,Castle Pines Golf Club,Castle Rock,CO,Private,18,4.5,true,false,true,When Golf Digest began its annual Best New Course awards in 1983, the review panel selected Castle Pines as the Private Course winner. But Bill Davis, co-founder of Golf Digest and founding father of all its course rankings, didn't care for the course and vetoed its inclusion. So, no private course was honored that year. Davis soon recognized his error, and in 1987—its first year of eligibility—Castle Pines joined America's 100 Greatest and has remained there ever since. Club founder Jack Vickers, a Midwest oilman, had urged architect Jack Nicklaus to produce a mountain-venue design worthy of a major championship. Jack did, but when a championship never resulted, Vickers established his own, The International, which for many years was the only PGA Tour event played under a unique Stableford format. The tour returned to Castle Pines in 2024 for the FedEx Cup's BMW Championship. Like Muirfield Village, the only other solo Nicklaus design in the top 50, Castle Pines has undergone a steady procession of hole alterations to keep pace with changing technology and changing tastes. It's been lengthened to over 8,000 yards, but in Castle Rock's thin air, that still only equates to about 7,300 yards.,Jack Nicklaus,1987,Vetoed for Best New Course 1983, joined top 100 in 1987. Hosted The International (Stableford format). FedEx Cup 2024.,FedEx Cup BMW Championship 2024,,,,,8000+ yards (7300 effective in thin air)
51,43,,,Sebonack Golf Club,Southampton,NY,Private,15,4.5,true,false,true,Not since Augusta National, or maybe Peachtree, had the nation's greatest golfer teamed with one of the most highly regarded course architects on a design project. But developer Michael Pascucci's joint venture by Jack Nicklaus with Tom Doak at Sebonack was complicated by the fact that golfer Nicklaus was also an esteemed course architect in his own right, and the project sat right beside two American icons, Shinnecock Hills and National Golf Links. Some pundits have reduced Sebonack to Tom's bunkers, Jack's greens, but in truth it's just the opposite. Doak convinced Nicklaus to go with small greens of sweeping contours and little imperfections the likes of which Jack would never have considered on his own. Meanwhile, Jack insisted that Tom tone down his usual ragged, jagged bunker faces to make them palatable to high-handicap club members. The course is fundamentally representative of neither designer's tenets, yet is a remarkable piece of architecture for the way it blends sometimes conflicting artistic outlooks into an ambitious whole on a genuinely inspiring piece of land.,Jack Nicklaus; Tom Doak,,Nicklaus-Doak collaboration. Next to Shinnecock Hills and National Golf Links. Doak convinced Nicklaus on small greens.,,,,,,Blends conflicting artistic outlooks
52,59,,,Sleepy Hollow Country Club,Scarborough,NY,Private,33,5,true,false,true,In the mid-2000s, the late George Bahto, who had extensively researched the works of legendary architect C.B. Macdonald, partnered with Gil Hanse and partner Jim Wagner to remodel Sleepy Hollow Country Club, which consisted of 11 Macdonald-designed holes and seven added in 1927 by A.W. Tillinghast. The pair persuaded the club to allow them to rebuild the entire 18 in Macdonald's style, reasoning that Tillinghast was well represented elsewhere in Westchester County (Winged Foot, Quaker Ridge and others), but Macdonald was not. The construction was done in stages, completed well after Bahto's death in 2014. Thanks to Hanse, Sleepy Hollow now features some of Macdonald's ideal holes, like the Eden, Knoll, Leven and Road holes that weren't even part of his original design. And it has steadily climbed in our rankings the past few editions. Sleepy Hollow hosted the 2023 U.S. Mid-Amateur.,C.B. Macdonald; A.W. Tillinghast; George Bahto; Gil Hanse; Jim Wagner (remodel),,11 Macdonald holes + 7 Tillinghast (1927). Rebuilt entire 18 in Macdonald's style. Added ideal holes not in original.,U.S. Mid-Amateur 2023,,,,,Steadily climbed rankings
53,52,,,Maidstone Club,East Hampton,NY,Private,29,5,true,false,true,Not only one of America's earliest links courses, Maidstone is also one of the country's earliest golf residential communities. Legend has it that Bobby Jones felt that Maidstone's final three holes made it one of the great match-play courses in America. If so, that's because the 17th has one of the tightest greensites in America, the putting surface sitting just in front of a major street intersection, with roads right and left less than 12 paces off each collar. As befitting a seaside course, Coore and Crenshaw cleared out brush and restored many sand dune areas and removed turf in some of the roughs to expose the sand beneath, while shaper Jeff Bradley returned the jagged, windswept edges to the bunkers. The result: ensuring Maidstone Club remains one of the greatest courses in the U.S.—a standout even in golf-rich Long Island.,Willie Park Jr.; William Tucker; Bill Coore; Ben Crenshaw; Jeff Bradley (restoration),,One of America's earliest links courses. Bobby Jones praised final three holes. Coore/Crenshaw restoration exposed sand.,,,,,,Tightest greensite on 17th
54,50,,,Myopia Hunt Club,South Hamilton,MA,Private,22,4.5,true,false,true,Few realize Myopia Hunt Club, a funky, quirky lark where greens look like bathmats and bunkers look like bathtubs, hosted four U.S. Opens by 1908 (two of them when the club had only nine holes). Although the Open hasn't been back in over 110 years, Myopia has always retained a reputation of being a tough little rascal with tiny greens, treacherous hazards and several cross-bunkers. Thanks to a Gil Hanse restoration, Myopia looks like it did in its U.S. Open heyday, but with much better turf conditions.,Herbert Leeds; Gil Hanse (restoration),,Hosted four U.S. Opens by 1908 (two with only nine holes). Funky, quirky design. Hanse restoration to U.S. Open heyday look.,U.S. Open (4 times by 1908),,,,,Greens look like bathmats, bunkers like bathtubs
55,62,monterey-peninsula-cc,Monterey Peninsula Country Club,Monterey Peninsula Country Club: Shore,Pebble Beach,CA,Private,22,4.5,true,false,true,Mike Strantz was battling cancer while transforming the bland, low-budget Shore Course into a scenic and strategic marvel that rivals next-door neighbor Cypress Point. Strantz reversed the direction of the fifth through 15th holes to provide a Pacific Ocean backdrop to most of them. He weaved fairways among trees so players could dance among the cypress, and added native grasses for a coastal prairie look. The stunning landscape would be Strantz's last work of art. He died six months after completing the redesign. Former PGA Tour player Forrest Fezler, who was Strantz's associate on the project, later served as a consulting architect to retain the Strantz vision, until he passed away, also from cancer, in 2018. Designer Dave Zinkand completed a renovation of the bunkers in 2025 to keep Strantz's artistry vivid.,Mike Strantz; Forrest Fezler; Dave Zinkand (2025 bunker renovation),,Strantz's last work (died 6 months after completion). Reversed holes 5-15 for Pacific backdrop. Fezler preserved vision until 2018 death.,,,,,,Strantz and Fezler both died of cancer
56,57,,,Somerset Hills Country Club,Bernardsville,NJ,Private,12,5,true,false,true,Somerset Hills is another marvelous A.W. Tillinghast design, one of the few that has remained virtually unchanged since it opened in 1918. So, it may be the most authentic Tillinghast course on the 100 Greatest. It's a charming, laid-back design that works through seemingly undisturbed rolling terrain, past rock outcroppings and around small-but-distinctive water hazards. Tilly designed this with a spoonful of whimsy, with dolomite mounds edging one green and startling knobs within another putting surface. Like Baltusrol Upper, Somerset Hills has a Tillinghast version of a Redan par 3, the second hole, which Golf Digest panelists ranked higher than any of the many splendid versions created by C.B. Macdonald or Seth Raynor, the pioneers of the template in the United States.,A.W. Tillinghast,1918,Virtually unchanged since 1918. Most authentic Tillinghast on top 100. Redan par-3 second ranked higher than Macdonald/Raynor versions.,,,,,,Charming laid-back design with whimsy
57,71,,,California Golf Club,South San Francisco,CA,Private,18,4.5,true,false,true,For a course that featured Alister MacKenzie bunkers (added just two years after it first opened), Cal Club was never considered the equal of its near neighbors, No. 35 Olympic Club (Lake) or No. 33 San Francisco Golf Club. That's partly because it was so claustrophobic, not just from dense trees, but from its truncated front nine reworked in the 60s by Robert Trent Jones after road expansion took two holes. Architect Kyle Phillips resolved the problem in 2007 by clearing trees and creating five new holes, including a new par-4 second in the old practice range and a new dogleg-right par-4 seventh atop a previously unused mesa in the middle of the course. Best of all, he reintroduced MacKenzie's glamorous bunkers. Cal Club is now much closer to its top-ranked neighbors and continues its meteoric rise up the charts, jumping to its highest position to date.,Alister MacKenzie; Robert Trent Jones; Kyle Phillips (2007 renovation),,MacKenzie bunkers added 2 years after opening. RTJ truncated front nine in 60s. Phillips 2007 renovation added 5 new holes.,,,,,,Meteoric rise up charts
58,64,,,Garden City Golf Club,Garden City,NY,Private,14,4,true,false,true,Minimalist in its design (you can still see the faint traces of old roadbeds over which the course was routed) and natural in its upkeep, Garden City Golf Club is one of the great early tournament venues in the United States. Before the 1908 U.S. Amateur, Walter Travis remodeled the course into what it is today, its strategies dictated by many deep pot bunkers. Travis installed them to promote thinking golf, but one player soon dubbed Garden City the home of the God-fearing approach shot. It's also a rare 100 Greatest course with a closing par-3.,Devereux Emmet; Walter Travis (1908 remodel),,Minimalist design over old roadbeds. Walter Travis 1908 remodel for U.S. Amateur. Deep pot bunkers promote thinking golf.,U.S. Amateur 1908,,,,,Rare 100 Greatest with closing par-3
59,49,,,Nanea Golf Club,Kailua Kona,HI,Private,15,5,true,false,true,In the early 1960s, Robert Trent Jones built the first course on Hawaii's Big Island for a very wealthy owner (Laurance Rockefeller), grinding up the site's volcanic rock to use as sand on which to grow grass. Forty years later and just 22 miles away, architect David McLay Kidd also built a course on volcanic rock for very wealthy owners (Charles Schwab and George Roberts), but rather than transform the lava topography, he routed his holes among the black outcroppings and through the site's meadows of native grasses. Located on a high, exposed plateau beneath Mt. Hualalai, the holes ramble and roll into topsy-turvy greens, each with a sterling view of the Pacific Ocean three and a half miles in the distance.,David McLay Kidd,,22 miles from RTJ's first Big Island course. Routed among black lava outcroppings. High plateau beneath Mt. Hualalai.,,,,,,View of Pacific 3.5 miles away
60,53,,,Victoria National Golf Club,Newburgh,IN,Private,25,4.5,true,false,true,Built atop Peabody Coal Company's long-abandoned Victoria strip mine in southern Indiana, Victoria National was a simple routing for Tom Fazio. He just followed the corridors (the perfect width for fairways) that existed between mining spoil mounds (long since overgrown with trees) and some 40 acres of fingery lagoons that had formed as steam shovels carving out coal deposits hit the water table. Chosen as Best New Private Course of 1999, Victoria National stunned most panelists. One gushed it was, the most unusual, unpolished and unpretentious Fazio design ever. Another called it, probably the hardest Fazio course I've played. More penal than Pine Valley. Fazio concurred with that assessment. It's U.S. Open-quality now, he said soon after it opened. If the wind blew, it'd be too hard.,Tom Fazio,1999,Built on abandoned coal strip mine. Best New Private Course 1999. Fairways between spoil mounds and lagoons.,,,,,,More penal than Pine Valley
61,65,bandon-dunes-resort,Bandon Dunes Resort,Bandon Trails,Bandon,OR,Public,52,4.5,true,true,true,The only one of Bandon Dunes' five 18-hole courses that isn't immediately adjacent to the Pacific coastline, Bandon Trails scores points other ways, taking players on a fantastic journey through three distinct ecosystems. The course starts in serious sand dunes, then turns inward toward meadows and dense Oregon rainforest, climbing toward an upper section at holes nine through 13. Fourteen is a love-it-or-hate-it par 4 to a thumb of a green personally fashioned by Crenshaw that can be driven with an unerring tee shot off a high bluff, dropping the holes back to the meadows and ultimately to the dunes at 17 and 18. Bump-and-run is the name of the game, but the structure of each hole requires thoughtful bumps and targeted runs. Bandon Trails is the favorite course of many Bandon Dunes frequenters, and for the first time in our rankings, it sits ahead of Old Macdonald, passing its neighbor to sit in its highest spot on our list in its history.,Bill Coore; Ben Crenshaw,,Only Bandon course not on Pacific coastline. Three distinct ecosystems: dunes, meadows, rainforest. Favorite of many frequenters.,,,,,,Passed Old Macdonald in rankings
62,58,,,Inverness Club,Toledo,OH,Private,52,4.5,true,false,true,Inverness is considered a classic Donald Ross design. In truth, it's one of his best remodeling jobs. Some Ross fans were outraged when the course was radically altered by George and Tom Fazio in preparation for the 1979 U.S. Open. The uncle-nephew duo eliminated four holes (including the famous dogleg par-4 seventh), combined two holes to make the par-5 eighth and created three modern holes on newly acquired land. In 2018, golf architect Andrew Green replaced the Fazio holes with new ones more in the Ross style, relocated greens on two other holes and added new back tees everywhere.,Donald Ross; George Fazio; Tom Fazio; Andrew Green (2018 restoration),,Ross remodeling job. Fazio duo altered for 1979 U.S. Open. Andrew Green 2018 restoration to Ross style.,U.S. Open 1979,,,,,Uncle-nephew Fazio eliminated famous dogleg 7th
63,68,,,Cherry Hills Country Club,Englewood,CO,Private,23,4.5,true,false,true,When Cherry Hills opened in the early 1920s, it was a ground-breaking design, with the nation's first par-5 island green and closing back-to-back par 5s, although in championships, the 18th is played as a par 4. In the 1960 U.S. Open, winner Arnold Palmer popularized the idea of a drivable par-4 by going for the first green in every round. Curiously, when Palmer and partner Ed Seay remodeled Cherry Hills in 1976, they lengthened the first hole so no player could duplicate Arnie's feat. Almost 50 years later, modern equipment has once again made the first hole reachable from the tee. A decade's worth of renovation and individual feature restoration by Tom Doak and Eric Iverson of Renaissance Golf have primed Cherry Hills for the next phase of its illustrious tournament history, which began with the 2023 U.S. Amateur.,William Flynn; Arnold Palmer; Ed Seay; Tom Doak; Eric Iverson (renovation),1920s,First par-5 island green. Palmer drivable par-4 first (1960 U.S. Open). Palmer/Seay lengthened it 1976. Doak/Iverson renovation.,U.S. Open 1960 (Arnold Palmer); U.S. Amateur 2023,,,,,Back-to-back closing par-5s
64,84,,,Interlachen Country Club,Edina,MN,Private,33,5,true,false,true,When Bobby Jones won the 1930 U.S. Open at Interlachen (completing the second leg of what would become the game's first Grand Slam), fellow competitor Gene Sarazen insisted the course was tougher than everything but Oakmont. In the decades that followed a series of architects including Robert Trent Jones, Geoffrey Cornish and Brian Silva worked to keep Interlachen's edge, but nothing could staunch the march of time that made the course one-dimensional through the shrinkage of greens and the maturation of the hundreds of trees that had been planted, shading fairways and masking the property's natural land movements. Enter Andrew Green in 2023, who was given the resources to strip back the layers and rebuild the course based on the blueprints Donald Ross developed in 1922 when he remodeled the course. Interlachen's edginess is back, with ominous, strategically arranged bunkers guarding greens and fairway lines, and the expanded putting surfaces presenting a range of come-and-get-me hole locations that haven't been seen in ages. The restored bunkering shines a spotlight on Interlachen's wondrous undulation, punctuating focal points like the shared promontory of the second and seventh greens and the majestic rise toward the fortress putting surface of the par-5 12th.,Donald Ross (1922 remodel); Robert Trent Jones; Geoffrey Cornish; Brian Silva; Andrew Green (2023 restoration),1922,Bobby Jones 1930 U.S. Open (Grand Slam leg). Andrew Green 2023 restoration based on Ross 1922 blueprints.,U.S. Open 1930 (Bobby Jones),,,,,Shared promontory of 2nd and 7th greens
65,56,,,Rock Creek Cattle Company,Deer Lodge,MT,Private,20,4.5,true,false,true,In the Rocky Mountain foothills north of Deer Lodge, Mont., Tom Doak fashioned a splendid inland links from a working cattle ranch. His broad, looping routing starts in pasture, makes a slow but steady climb to the seventh tee, then plays through pines and over the ravines of Rock Creek, as gorgeous a fly-fishing stream as can be imagined. At the ninth, the course bursts back into the open, atop rolling hills offering hogback, punchbowl and sideslope fairways, then rolls downward and homeward, finishing back along the stream. Doak moved little earth because it was so rocky. Greens are huge to fit the scale, and bunkers are shaped to emulate those blown out by constant winds. Rock Creek Cattle Co. is high-country golf at its finest.,Tom Doak,,Working cattle ranch in Rocky Mountain foothills. Minimal earth moved (rocky). Huge greens, wind-blown bunkers.,,,,,,High-country golf at its finest
66,51,,,Whispering Pines Golf Club,Trinity,TX,Private,19,5,true,false,true,Corby Robertson, who made a fortune in coal reserves, staked out the Whispering Pines course in the early 1990s, then brought Texas-based golf architect Chet Williams (at the time a design associate of Jack Nicklaus) to help him create strategies through bunkering and green contours. Williams refined the rough-hewn routing cut through east Texas piney woods into a dazzling romp across a gently rolling landscape, culminating in a final six-hole stretch along gator-infested Caney Creek and the headwaters of Lake Livingston. The club continues to make renovations, which have included tweaking greens, moving tee boxes and replacing its fairways with zoysia grass, which resulted in a No. 66 ranking on our America's 100 Greatest list.,Chet Williams,1990s,Coal reserves fortune founder. Chet Williams design (Nicklaus associate). Final six-hole stretch along gator-infested creek.,,,,,,Recent zoysia fairway replacement
67,73,congressional-cc,Congressional Country Club,Congressional Country Club: Blue,Bethesda,MD,Private,30,4.5,true,false,true,Congressional's Blue Course has been an icon of traditional American parkland golf since the 1964 U.S. Open. Prior to that event, Robert Trent Jones combined nine remodeled Devereux Emmet holes with nine new ones of his own to create the modern Blue, and those holes were remodeled and reshaped several times by his son Rees for the 1997 and 2011 Opens. All the while, the trees around them matured, creating dense, shadowy corridors of wood. Drainage issues and declining course conditions motivated the membership to consider a major overhaul in 2020, and that's what they received when architect Andrew Green reimagined the course as something that Emmet might have originally designed. This denudes the property of its forests and creates broad, rollicking fairways that tumble through meadows of long fescue punctuated by fearsome bunkers and bold, segmented greens. Parkland Golf Congressional is no more, and the remodel, which included a new, drop-shot par-3 10th hole, earned the course our Best Transformation award for 2021 and a jump of 18 spots in that year's ranking of America's 100 Greatest Courses. Congressional's Blue course then climbed another five spots in this year's ranking, emphatically reversing a trend of the course nearly slipping out of our 100 Greatest.,Devereux Emmet; Robert Trent Jones; Rees Jones; Andrew Green (2020 reimagination),,RTJ combined Emmet and new holes for 1964 U.S. Open. Rees remodeled for 1997/2011 Opens. Green 2020 transformation.,U.S. Open 1964, 1997, 2011,,,,,Best Transformation 2021, jumped 18 spots
