usRanking,previousRank,clubId,clubName,name,city,state,courseType,panelistCount,starRating,in100Greatest,in100GreatestPublic,bestInState,description,designers,yearOpened,notableHistory,majorTournaments,address,phone,website,par,yardage,notes
68,69,,,Calusa Pines Golf Club,Naples,FL,Private,31,4.5,true,false,true,Calusa's developer, Gary Chensoff, a Chicago venture capitalist, survived a rare form of cancer despite long odds, and his recovery strongly influenced how Calusa Pines was designed and built. Chensoff decided to gamble, instructing Hurdzan-Fry to design the most unique course in South Florida despite a dead flat site. They responded by piling up fill from ponds to form ridgelines up to 58 feet, then planted them with mature oaks, pines and sabal palms. Calusa Pines sports perhaps the firmest, fastest Bermuda fairways and greens in Florida, currently rivaled only by the turf at Streamsong. Recent removal of overgrown vegetation between holes has returned beautiful long-range views to the course and made it more playable. Calusa Pines continues to creep forward in the ranking, moving up one more place this year.,Michael Hurdzan; Dana Fry,,Developer survived cancer, influenced design. Dead flat site transformed with 58-foot ridgelines. Firmest Bermuda in Florida.,,,,,,Continues creeping up rankings
69,NEW,sand-valley,Sand Valley,Sand Valley: The Lido,Nekoosa,WI,Public,48,4.5,true,true,true,The Lido at Sand Valley in central Wisconsin opened in May 2023 and is a down-to-the-inch recreation of The Lido that C.B. Macdonald built on Long Island from 1914 to 1917. Heralded as one of the country's greatest courses, it went extinct in the 1940s when the U.S. government converted the land to a naval base. The Lido is alive again as a private club associated with Sand Valley Resort. The club operates in the same vein as the clubs of the British Isles, allowing select play from resort guests on Mondays through Thursdays.Rebuilding The Lido has been the fantasy of many historians, but doing so accurately became possible when Peter Flory, a financial consultant and architecture enthusiast, developed a detailed computer simulation of the course based on scrupulous study of old photographs and other material. Sand Valley proprietors Michael and Chris Keiser discovered Flory's computer model, then asked architect Tom Doak if he could use it to rebuild the course.First, the animated contours had to be translated into a physical GPS topographical blueprint, a technological hack accomplished by digital mapping specialist Brian Zager. The GPS map enabled Doak and his associates to reconstruct Lido holes like Plateau, Alps, Cape and Long in exquisite detail, along with originals like the Dog's Leg sixth and the Home 18th, making only minor adjustments for drainage and adding longer tees for modern play. Though there's no Atlantic Ocean crashing near the Biarritz eighth green or stiff coastal winds swatting around balls, the new Lido is a stunning representation of Macdonald's groundbreaking accomplishment and a vivid throwback to a more daring era of architecture. Using the spacious hole corridors to explore different routes into the giant greens is half the fun. Contemplating players navigating holes like the Channel fourth, with an alternative island fairway for daring hitters and a green perched behind a high rampart bunker, using hickory shafts and Haskell balls, is the other half.,C.B. Macdonald (original 1914-1917); Tom Doak (2023 recreation),2023,Recreation of extinct Lido (1914-1917). Computer simulation by Peter Flory. GPS mapping by Brian Zager. Opened May 2023.,,,,,,First appearance in top 100 (NEW)
70,70,,,The Estancia Club,Scottsdale,AZ,Private,11,4.5,true,false,true,Estancia, our Best New Private Course of 1996, was Tom Fazio's initial entry into the Scottsdale scene. Positioned beneath the north slopes of Pinnacle Peak and routed to provide a variety of uphill and downhill shots and a change of direction on almost every hole, Estancia is an easterner's version of rock-and-cactus architecture, with wide turf corridors, few desert carries and greens wilder than most. Former Fazio design associate Kevin Sutherland (no relation to the PGA Tour player of the same name) has made slight design adjustments in recent years.,Tom Fazio; Kevin Sutherland (adjustments),1996,Best New Private Course 1996. Fazio's initial Scottsdale entry. Positioned beneath Pinnacle Peak.,,,,,,Easterner's version of desert golf
71,NEW,,,CapRock Ranch,Valentine,NE,Private,18,5,true,false,true,The original owner of this property in north-central Nebraska first contacted Gil Hanse to design the course in the early 2000s. It took nearly 20 years—and different ownership—to complete the task, but the wait was worth it. Opened in 2021, the members-only CapRock Ranch is an invigorating addition to the golf wonderland that is the vast Nebraska Sandhills, where architects strive to do as little as possible. Much of the course explores the gentle, grass-covered dunesland, and the other—eight holes, to be exact—frolic along and over the pine-forest rim of the Snake River Canyon, dropping several hundred feet to the bottom. Scoring in both splash and sublimity, CapRock is uncommonly diverse and picturesque, a meeting of melodic minimalism and dopamine rush.,Gil Hanse,2021,Took 20 years to complete. Opened 2021. Eight holes along Snake River Canyon rim. NEW to rankings.,,,,,,Meeting of minimalism and dopamine rush
72,63,,,Old Sandwich Golf Club,Plymouth,MA,Private,16,4.5,true,false,true,Old Sandwich Golf Club may be the craftiest Coore-Crenshaw design yet built. Amidst its pines, scrub oaks, gnarly bunkers, chocolate drop mounds, wavy fescue and briar bushes are hints of Baltusrol, National Golf Links, Pine Valley, Pinehurst #2 and Chicago Golf Club in its cross-bunkering, hazard placement and sandy waste areas. The greens are some of the most rolling of any Coore & Crenshaw design, seeded with a half-dozen bent varieties to give them an old-fashioned mottled appearance. Nobody does old-fashioned better than Coore & Crenshaw.,Bill Coore; Ben Crenshaw,,Craftiest Coore-Crenshaw design. Hints of Baltusrol, National, Pine Valley, Pinehurst #2, Chicago. Most rolling greens.,,,,,,Nobody does old-fashioned better
73,93,medinah-cc,Medinah Country Club,Medinah Country Club: No. 3,Medinah,IL,Private,27,4.5,true,false,true,The evolution of golf course architecture—and how courses change to suit the demands of the times—can be mapped directly on top of Medinah's No. 3 course. It was built in the 1920s within the fields west of Chicago on land that was part farmland and partly wooded. It became a major championship site when it hosted the 1949 U.S. Open, putting it on a track of perpetual improvements to toughen it up to keep pace with tournament demands. To whit, the old 17th hole, a par-3 over water, shifted and morphed several times between 1986 and 2005, and the greens and bunkers have undergone remodels ahead of each event, from Opens, to PGA Championships to Ryder Cups. But when No. 3 was blistered to the tune of 25-under during the 2019 BMW Championship, which coincided with a plunge in our rankings from 53rd to 93rd, the club knew it was time to adapt again. They took a swing and hired the Australian firm of Ogilvy, Cocking and Mead to overhaul the design with the notion of making the course look and play like it might have in the 1920s. That meant removing much of the dense forest surrounding the holes, revamping the bunkers in more naturalistic forms, enlarging the greens and adding internal contour, eliminating two of the three redundant par 3s that played over Lake Kadijah and building several new holes, including the drivable 16th over the lake. The radical shift has put the fun, firmness and variety back into a design that had become one-dimensional, predictable and soft, and the result is a jump of 19 spots in the ranking.,Tom Bendelow; Ogilvy, Cocking and Mead (overhaul),1920s,Built 1920s. Hosted 1949 U.S. Open. Blistered 25-under in 2019. Ogilvy, Cocking & Mead overhaul removed forest, added variety.,U.S. Open 1949, 1975, 1990; PGA Championship; Ryder Cup,,,,,Jumped 19 spots after transformation
74,81,,,Quaker Ridge Golf Club,Scarsdale,NY,Private,22,4.5,true,false,true,Quaker Ridge returned to our list of America's 100 Greatest Courses in 2013 thanks to major revisions by Gil Hanse that included removal of many trees and the rebuilding of bunkers; Hanse remains the consulting architect as the club is fine-tuning this A.W. Tillinghast design each year. This includes reclaiming putting surfaces back to Tillinghast dimensions, except on the sporty par-4 17th green, where a left-hand lobe that had been added by Frank Duane in 1964 was chopped off. Quaker's strong suit has long been its powerful par-4s, such as the fourth hole with a collection of hazards needing to be navigated off the tee, the sixth, where tee shots must be squeezed between a creek and hillside and the drive-and-pitch 11th, where the green is girdled by a stream. Though Winged Foot's greens are widely considered some of the best in golf, don't sleep on the Tilly down the street.,A.W. Tillinghast; Gil Hanse (2013 restoration),,Returned to top 100 in 2013 via Hanse restoration. Tree removal, bunker rebuilding. Powerful par-4s.,,,,,,Don't sleep on Tilly down from Winged Foot
75,67,,,Spyglass Hill Golf Course,Pebble Beach,CA,Public,40,4.5,true,true,true,Given the task of designing a course just up the 17 Mile Drive from Pebble Beach and Cypress Point, Robert Trent Jones responded with a combination of Pine Valley and Augusta National. The five opening holes, in Pine Valley-like sand dunes, are an all-too-brief encounter with the Pacific seacoast. The remaining holes are a stern hike through hills covered with majestic Monterey pines (which, sad to say, may someday disappear to pitch canker, but are being replaced in some areas with cypress trees). Add several water hazards that hearken back to the 16th at Augusta (a hole which Trent Jones designed, by the way), and you have what some panelists consider to be Trent's finest work. Others say it's the best course never to have hosted a major event (though it was conceived to do so). After all, even Pine Valley and Cypress Point have hosted Walker Cups.,Robert Trent Jones,,Combination of Pine Valley and Augusta. Five opening holes in dunes by Pacific. Trent Jones finest work per some.,,,,,,Best course never to host a major
76,79,monterey-peninsula-cc,Monterey Peninsula Country Club,Monterey Peninsula Country Club: Dunes,Pebble Beach,CA,Private,31,4.5,true,false,true,The Dunes Course, long in the shadow of its big brother Shore Course (ranked 55th), was originally routed by Seth Raynor, who died before construction. It was completed by Robert Hunter, a partner to Alister MacKenzie (who did not participate in the work), and Raynor's ideas for the greens were altered before they were even built. In the 1990s, Rees Jones remodeled the course and reshaped holes to mimic the Raynor look, to mixed reviews. In 2016, Tom Fazio was brought in to make the Dunes as appealing to members as the gorgeous Shore Course, though it was former associates Tim Jackson and David Kahn who conceived of and carried out the details of the plan to give the Dunes a MacKenzie look. Sandscapes now frame most holes, fairways now zigzag around jagged bunkers and nearly all the greens are oriented diagonally to lines of play. The Dunes Course now lives up to its name—and its current ranking is the highest in the history of our list.,Seth Raynor; Robert Hunter; Rees Jones; Tom Fazio; Tim Jackson; David Kahn,,Raynor died before construction. Hunter completed. Rees remodeled 1990s. Fazio/Jackson/Kahn gave MacKenzie look 2016.,,,,,,Highest ranking in history
77,78,,,Essex County Club,Manchester,MA,Private,33,5,true,false,true,Essex County Club is considered the first great Donald Ross design and perhaps his most intriguing. He wasn't the original architect, but he served as its professional from 1909 to 1913 (until his design business became so lucrative he no longer needed the pro job) and lived on site, so he was able to tweak many holes. Ultimately, he returned to do a substantial remodeling in 1917. Unusual holes are the order of the day, from the flat opening six holes with fuzzy chocolate drops covered in tall fescue grasses to the blind shots, both uphill and downhill, on the back nine. The par-3 11th, with its green resembling the deck of a sinking ship, and the downhill par-4 18th, shaped like an S around small hills, are special. The club insists its third green, created in 1893 and preserved by Ross in his remodel, is the oldest green in continuous existence in America.,Donald Ross,1917,Ross served as pro 1909-1913, lived on-site, tweaked holes. 1917 substantial remodeling. Oldest green in America (1893).,,,,,,Unusual holes with blind shots
78,74,,,Kinloch Golf Club,Manakin Sabot,VA,Private,24,5,true,false,true,Since the only way to successfully establish bentgrass tees, fairways and greens in hot, humid Richmond was to create expansive corridors to allow plenty of sunlight and air to the turf, Kinloch Golf Club has more double fairways posing options and alternate routes than nearly every other course on the 100 Greatest, except perhaps The Lido and National Golf Links of America. In 2016, Lester George prepared a long-range master plan of adjustments, including expansion of the alternate fairways on nine and 11, for improved visibility and playability, and removal of thick rough between bunkers and fairway edges. Enhancements will continue in the future.,Lester George,2016,Bentgrass in hot Richmond required expansive corridors. More double fairways than almost any course. 2016 master plan.,,,,,,More options than almost any course
79,NEW,,,Oak Tree National,Edmond,OK,Private,16,4.5,true,false,true,Oak Tree National was originally the men's-only Oak Tree Golf Club, with 18 holes patterned after previous Dye designs (the par-3 eighth, for example, was a close cousin to his 17th at Harbour Town, complete with a basket trap on the back left). It has long been considered one of Pete Dye's sternest tests of golf, a hilly layout with numerous water hazards and deep bunkers protecting some very tiny greens, as well as gusting Oklahoma winds and gnarly Bermudagrass rough. It's been a PGA Tour Champions fixture in recent years, hosting the 2006 Senior PGA Championship and the 2014 Senior U.S. Open. Recent touch-ups by Tripp Davis have kept Dye's architecture sharp.,Pete Dye; Tripp Davis (touch-ups),,Originally men's-only Oak Tree Golf Club. Patterned after previous Dye designs. Hilly with water and deep bunkers.,Senior PGA Championship 2006; Senior U.S. Open 2014,,,,,NEW to rankings, PGA Tour Champions fixture
80,72,streamsong-resort,Streamsong Resort,Streamsong Resort: Blue,Bowling Green,FL,Public,51,4.5,true,true,true,Streamsong Resort's Blue course was one of two 18s that opened simultaneously in January 2013 at this former phosphate mine in central Florida, designed by two different architects. (The Red Course also debuted in 2013, though ranked a bit lower, at No. 85 this year.) Doak's Blue course is pure linksland, from the massive craters to the blown-out bunkers to its fescue fairways and greens, which take on the color of beach straw in winter. It's Florida's only true fescue golf course, and the only one that honestly replicates British seaside conditions.,Tom Doak,2013,Opened January 2013 at former phosphate mine. Pure linksland design. Florida's only true fescue course.,,,,,,Replicates British seaside in Florida
81,72,bandon-dunes-resort,Bandon Dunes Resort,Old Macdonald,Bandon,OR,Public,52,4.5,true,true,true,Old Mike Keiser had a course. Name of Bandon Dunes. Hugged the cliffs of Oregon gorse. It made golfers swoon. So he added one more, then a third next door. Here a lodge, there a hut, even built a pitch & putt. Now it's America's top resort. Name of Bandon Dunes. But Old Mike Keiser wanted more. Down at Bandon Dunes. An ode to an architect he adored. Cut from heather and broom. So Old Macdonald came to be. In spite of a bad economy. Here it's big, there it's bold. Everywhere it looks real old. A Road Hole here, a Cape Hole there. Bottle Hole, Biarritz, ocean winds that'll give you fits. Short and Eden fit the scenes. Especially with enormous greens. Old Macdonald is part of the lore. Now at Bandon Dunes.,Tom Doak; Jim Urbina,,Fourth course at Bandon. Template holes: Road, Cape, Bottle Hole, Biarritz, Short, Eden. Enormous greens.,,,,,,Ode to C.B. Macdonald
82,60,,,Scioto Country Club,Columbus,OH,Private,30,4.5,true,false,true,The Donald Ross design at Scioto was the site of three prominent tournaments—the 1926 U.S. Open, won by Bobby Jones, the 1931 Ryder Cup and the 1950 PGA Championship. That course was gone by the time the '68 U.S. Amateur came to Scioto, replaced in 1963 by a modern design from Dick Wilson, who delegated one nine to associate Joe Lee and the other to associate Robert von Hagge. Several other renovations by Michael Hurdzan and Jack Nicklaus, who grew up playing the course, followed in the 2000s, creating yet a third iteration of the course. Enough, the club said. They hired Andrew Green in 2021 to restore the course to the full Donald Ross version based on drawings, photos and an old aerial illustration from the '26 Open. Green lowered green complexes, emboldened contours, recreated Ross' sharp-faced bunkering and returned the small green at the par-3 17th to the near side of a creek where it originally was.,Donald Ross; Dick Wilson; Joe Lee; Robert von Hagge; Michael Hurdzan; Jack Nicklaus; Andrew Green (2021 restoration),,Ross hosted 1926 U.S. Open (Bobby Jones), 1931 Ryder Cup, 1950 PGA. Green 2021 restoration to Ross original.,U.S. Open 1926 (Bobby Jones); Ryder Cup 1931; PGA Championship 1950,,,,,Jumped from 60 to 82 after restoration
83,NEW,,,Ladera Golf Club,Thermal,CA,Private,20,5,true,false,true,Ladera breaks every rule of desert golf in Palm Springs and the Coachella Valley. The design does not incorporate unnatural water features, it's not lined by palm trees, it's not criss-crossed by cart paths and it's not hemmed in by housing, no matter how expensive. Instead, it is a beautiful and varied expression of what desert golf can be in its most natural form, though nothing about it is natural. The 300-acre site slopes 140 feet from the high point near the Santa Rosa Mountains across once-level land that was formerly lemon groves and mango farms. Gil Hanse and Jim Wagner propped up the low side of the property to reorient sightlines over the valley floor toward the eastern Mecca Hills and moved millions of cubic yards of earth to create each particle of golf. Ladera's fairways are generous, 60 to 100 yards wide with no formal rough, but strategy abounds with options to play to wide parts of the fairway—though the best approach angles and lines of sight are reserved for those who skirt the boundaries of the hazards. Even completely straight holes, such as the par-5 seventh, are full of options with staggered bunkers and a treacherous side slope short of the green. The greens reveal a tremendous variety of sizes and forms, some modestly contoured like the enormous saucer third and others a pattern of ridges and falling tiers (the 14th). But the most distinctive features at Ladera are the attractive dry gullies and arroyos that Hanse, Wagner and their team cut through the site emulating sandy, eroded vegetative lows that water would rush through during rare periods of heavy rain. The excavated sand was used to create sweeping elevation changes and to prop up greens like the par-3 fourth, the altar-like 15th, the par-3 16th and the par-5 17th that hangs over the edge of a deep barranca.,Gil Hanse; Jim Wagner,,NEW to rankings. Breaks all desert golf rules. 300-acre site slopes 140 feet. Millions of cubic yards moved. 60-100 yard wide fairways.,,,,,,Natural desert golf without artificiality
84,80,baltusrol-gc,Baltusrol Golf Club,Baltusrol Golf Club: Upper,Springfield,NJ,Private,27,4.5,true,false,true,It's believed that when A.W. Tillinghast began constructing the Upper and Lower Courses at Baltusrol in 1919 (replacing Baltusrol's existing 18 holes), it was the first contiguous 36 holes built at the same time in America. Because of the Lower's tremendous major championship record, most consider the slightly shorter Upper to be a secondary course at the club. But between the two, it was the Upper, not the Lower, that hosted the first U.S. Open (and third in the club's history) in 1936, won by Tony Manero. The Lower didn't get its first Open until 1954, won by Ed Furgol. Baltusrol Mountain, just 200 feet high, looms above the right flank of the Upper, complicating drives and putts with a landscape that tilts more than appears to the eye. Just like he did at the Lower, Gil Hanse and his team finished a complete restoration of the Upper in 2024, the fruits of which won't appear in this ranking until 2027.,A.W. Tillinghast; Gil Hanse (2024 restoration),1919,First contiguous 36 holes in America (1919). Upper hosted first U.S. Open 1936. Hanse 2024 restoration.,U.S. Open 1936 (Tony Manero),,,,,Restoration results in 2027 ranking
85,91,,,The Quarry at La Quinta,La Quinta,CA,Private,23,5,true,false,true,The developers of The Quarry hired Tom Fazio in the early 1990s with instructions that he top his design of Shadow Creek (ranked No. 24 on this year's list). Fazio was savvy enough to ignore those instructions because he recognized The Quarry's site was a much better piece of topography than what he'd been provided in Las Vegas. Thus, The Quarry has more variety, starting and ending in a gravel quarry now lavishly landscaped. In between, holes play on high desert overlooking the Palm Springs Valley and in a valley, with four holes tucked in an isolated notch of the Santa Rosa Mountains. The course regularly receives some of the highest Conditioning scores in the country.,Tom Fazio,1990s,Fazio ignored instructions to top Shadow Creek. Better topography. Gravel quarry lavishly landscaped. Highest Conditioning scores.,,,,,,More variety than Shadow Creek
86,85,,,Canyata Golf Club,Marshall,IL,Private,14,4,true,false,true,Energy-industry CEO Jerry Forsythe grew up in east central Illinois and wanted to convert 300 acres of his childhood memories into a family retreat. After golf architect Bob Lohmann built him an elaborate three-hole golf course on the property, Lohmann's then-associate Mike Benkusky convinced Forsythe to stretch it to nine holes and later into a full 18. Ultimately, two million cubic yards of cornfield were moved to form Canyata's massive fairways and greens, which are edged by waterscaped ponds, artificial creeks and a dazzling array of bunkers. With only a handful of rounds played each year by invited guests, Canyata's manicuring is always nearly flawless. That changed in 2025 after the course's acquisition by Texas-based Escalante Golf, which opened the club to a small national membership.,Bob Lohmann; Mike Benkusky,,CEO's childhood memories converted to family retreat. 2 million cubic yards of cornfield moved. Acquired by Escalante Golf 2025.,,,,,,Opened to national membership 2025
87,75,,,Butler National Golf Club,Oak Brook,IL,Private,33,4.5,true,false,true,Butler National was former tour player George Fazio's ideal of a championship course, with 10 forced carries over water in 18 holes. Even before it opened, it was signed to eventually serve as a permanent site of the Western Open. The problem was, when it opened, it was the last cool-weather venue on the PGA Tour to utilize bluegrass rather than bentgrass for its fairways, and several prominent golfers declined to play Butler National because of potential flyer-lies from those fairways. Eventually, the turf was converted, but then the Shoal Creek scandal occurred. Rather than change its restricted men-only policy, the club relinquished its role of Western Open host after the 1990 event. So why include a club on America's 100 Greatest that won't allow female panelists a chance to evaluate it? Because we rank golf courses, not club policies.,George Fazio,,Fazio's championship ideal. 10 forced water carries. Relinquished Western Open hosting 1990 after men-only policy controversy.,Western Open (until 1990),,,,,Ranks course not club policies
88,88,,,Hudson National Golf Club,Croton On Hudson,NY,Private,40,4,true,false,true,Hudson National rests on dramatic bluffs high over the Hudson River valley, a breathtaking location that, back in the 1920s, had been the site of the ill-fated Hessian Hills Country Club. (The fireplace and part of the foundation of its clubhouse still exists near the fourth green.) Fazio paid little attention to the old routing, however, dynamiting more than 130,000 cubic feet of granite to fit his design into the rocky terrain. Greens are blazing fast, the primary rough is wispy fescue and bunkers are deep and numerous. Hudson National closed in 2023 as the Fazio team returned for a complete remodeling, finishing plans they couldn't execute the first time around. The entire course was re-grassed with modern bents, bunkers were shifted and reshaped and greens were enlarged with several reoriented with new low-mow chipping areas as surrounds. The most notable improvements are the new, larger and three-dimensionally sculpted fifth green replacing one of the most placid on the course and the new green at the par-5 14th set tight against a lake that's been elongated and extended 25 yards to create more tantalizing back hole locations.,Tom Fazio,1920s,Dramatic bluffs over Hudson River. Dynamited 130,000 cubic feet of granite. Fazio team 2023 complete remodel.,,,,,,Site of ill-fated Hessian Hills CC
