usRanking,previousRank,clubId,clubName,name,city,state,courseType,panelistCount,starRating,in100Greatest,in100GreatestPublic,bestInState,description,designers,yearOpened,notableHistory,majorTournaments,address,phone,website,par,yardage,notes
23,21,bandon-dunes-resort,Bandon Dunes Resort,Pacific Dunes,Bandon,OR,Public,59,5,true,true,true,This was the second course constructed at Bandon Dunes Resort and the highest-ranked among the resort's five 18s. To best utilize ocean frontage, Tom Doak came up with an unorthodox routing that includes four par 3s on the back nine. Holes seem to emerge from the landscape rather than being superimposed onto it with rolling greens and rumpled fairways framed by rugged sand dunes and marvelously grotesque bunkers. The secret is that Doak moved a lot of earth in some places to make it look like he moved very little, but the result is a course with sensual movements, like a tango that steps toward the coast and back again, dipping in and out of different playing arenas from the secluded sand blowouts to the exposed bluffs and all variations in between.,Tom Doak,,Second course at Bandon Dunes Resort. Highest-ranked of five 18s. Four par 3s on back nine.,,,,,,Unorthodox routing maximizes ocean frontage
24,27,,,Shadow Creek,North Las Vegas,NV,Public,26,5,true,true,true,Shadow Creek has the reputation of being one of the most expensive courses built in America, a reported $47 million at the time, which translates to roughly $120 million in today's dollars. Designer Tom Fazio said that a budget was necessary at Shadow Creek to perform what he now calls total site manipulation, creating an environment where none existed by carving rolling hills and canyons from the flat desert floor north of Las Vegas and pumping in plenty of water. Alas, this once-in-a-lifetime dream design has been too successful, triggering many equally expensive, but inferior, imitations.,Tom Fazio,,Reported $47 million construction cost ($120M today). Total site manipulation creating environment from desert floor.,,,,,,One of most expensive courses built in America
25,23,,,Prairie Dunes Country Club,Hutchinson,KS,Private,23,5,true,false,true,Prairie Dunes was the top nine-hole course in America for 20 years. By the time the club found funds to expand it to 18, original architect Perry Maxwell had passed away, but his son Press was able to add nine more holes seamlessly in the 1950s, putting three on the front nine and six on the back. He also replicated his father's great greens, which seem to break in three different directions. Prairie Dunes reflects all that is common in rural Kansas: sand dunes, prairie grasses, yucca plants, cottonwoods and constant wind.,Perry Maxwell; Press Maxwell,1950s,Top nine-hole course for 20 years. Press Maxwell added nine holes in 1950s after Perry's death.,,,,,,Rural Kansas setting with constant wind
26,26,whistling-straits,Whistling Straits,Whistling Straits: Straits Course,Sheboygan,WI,Public,56,5,true,true,true,Pete Dye transformed a dead flat abandoned army air base along a two-mile stretch of Lake Michigan into an imitation Ballybunion at Whistling Straits, peppering his rugged fairways and windswept greens with 1,012 (at last count) bunkers. There are no rakes at Whistling Straits, in keeping with the notion that this is a transplanted Irish links. It has too much rub of the green for the comfort levels of many tour pros, which is what makes it a stern test for top events, such as three PGA Championships, the 2007 U.S. Senior Open and the 2021 Ryder Cup.,Pete Dye,,Transformed abandoned army air base. 1,012 bunkers. No rakes (Irish links style).,PGA Championships (3); U.S. Senior Open 2007; Ryder Cup 2021,,,,,Imitation Ballybunion
27,32,,,Wade Hampton Golf Club,Cashiers,NC,Private,21,5,true,false,true,Built during the period when Tom Fazio was still working with the existing landscape rather than bulldozing it, Wade Hampton is an exercise in restraint. The fairways flow through a natural valley between flanking mountain peaks. Some holes are guarded by gurgling brooks, but Fazio piped several streams underground to make the course more playable and walkable. Selected as Golf Digest's Best New Private Course of 1987, it has never been out of the top 40 since it joined America's 100 Greatest.,Tom Fazio,1987,Best New Private Course 1987. Never out of top 40 since joining top 100.,,,,,,Exercise in restraint by Fazio
28,28,,,Southern Hills Country Club,Tulsa,OK,Private,19,5,true,false,true,A product of the Great Depression and constructed by hundreds of workers who stood at the gate each morning hoping for a 25-cents-per-hour job that day, Southern Hills is architect Perry Maxwell's great achievement. Nearly every hole bends left or right, posing critical tee shots that must risk something. The putting surfaces have the classic Maxwell Rolls, and most are guarded by simple yet effective bunkers. During the summer of 2018, architect Gil Hanse and crew rebuilt much of the course, in the process re-establishing Maxwell's distinctive, gnarly-edged bunkering and reconstructing the green shoulders that had been built up over the years. Hanse's changes were on display at the 2022 PGA Championship, and the club will host the event for a sixth time in 2032.,Perry Maxwell; Gil Hanse (2018 rebuild),,Great Depression construction. Gil Hanse 2018 rebuild re-established Maxwell's bunkering.,PGA Championship 2022; PGA Championship 2032 (scheduled),,,,,Maxwell Rolls putting surfaces
29,31,,,The Honors Course,Ooltewah,TN,Private,21,5,true,false,true,Considered radical in the early 1980s because of its acres of tall, native-grass rough, durable zoysiagrass fairways and terrifying greens perched atop bulkheads of rock, today The Honors Course is considered a well-preserved example of Pete Dye's death-or-glory architecture. Other than reducing the contours in a couple of greens (particularly the 18th) in the late 1990s, and adjusting the bunkering in 2008, Dye left the course alone for most of his career. Georgia architect Bill Bergin created a new practice facility at the club in 2015, and Gil Hanse and Jim Wagner touched everything up again in 2022.,Pete Dye; Bill Bergin; Gil Hanse; Jim Wagner,1980s,Radical in early 1980s. Well-preserved Dye death-or-glory architecture. Hanse/Wagner updates 2022.,,,,,,Terrifying greens on rock bulkheads
30,24,kiawah-island-resort,Kiawah Island Golf Resort,Kiawah Island Golf Resort: The Ocean Course,Kiawah Island,SC,Public,49,5,true,true,true,The Ocean Course was designed on short notice for a specific event, the 1991 Ryder Cup, when the PGA of America decided to move the event from California to the more attractive Eastern time zone television time slot. This manufactured linksland-meets-lagoons layout might well be Pete Dye's most diabolical creation. Every hole is edged by sawgrass, every green has tricky slopes and every bunker merges into bordering sand dunes. Strung along nearly three miles of ocean coast, Dye took his wife Alice's advice and perched fairways and greens so golfers can actually view the Atlantic surf over a ridge of beach dunes. That also exposes shots and putts to ever-present and sometimes fierce coastal winds. The Ocean Course will forever be linked with Phil Mickelson and his improbable victory at the 2021 PGA Championship, as well as Rory McIlroy's romp in 2012.,Pete Dye,1991,Designed for 1991 Ryder Cup. Manufactured linksland-meets-lagoons. Three miles of ocean coast.,Ryder Cup 1991; PGA Championship 2012 (Rory McIlroy), 2021 (Phil Mickelson),,,,,Dye's most diabolical creation
31,30,,,Pikewood National Golf Club,Morgantown,WV,Private,17,4.5,true,false,true,In 2000, mining company officers John Raese and Bob Gwynne started building a golf course on a newly acquired parcel of forest that their firm will eventually—a hundred years from now—mine for high quality limestone. Using company engineers and construction equipment, and guidance by veteran tour pros Johnny Pott and Dow Finsterwald, they spent almost a decade creating Pikewood National. A natural waterfall became the backdrop for their par-3 fifth hole and the linchpin of their routing, which plays along bluffs, through forest over rapids, and on the hook-shaped par-5 eighth, around a gulch.,Johnny Pott; Dow Finsterwald,2000,Built by mining company officers over a decade. Will eventually be mined for limestone in 100 years. Natural waterfall featured.,,,,,,Future limestone mining site
32,29,,,Pinehurst No. 2,Pinehurst,NC,Public,51,5,true,true,true,In 2010, a team led by Bill Coore and Ben Crenshaw killed and ripped out all the Bermudagrass rough on Pinehurst #2 that had been foolishly planted in the 1970s. Between fairways and tree lines, they established vast bands of native hardpan sand dotted with clumps of wiregrass and scattered pine needles. They reduced the irrigation to mere single rows in fairways to prevent grass from ever returning to the new sandy wastelands. Playing firm and fast, it was wildly successful as the site of the 2014 Men's and Women's U.S. Opens, played on consecutive weeks, and produced an even more exciting Open in 2024 when Bryson DeChambeau beat Rory McIlroy on the final hole. It's the rare course that a wide variety of resort players can enjoy and play quickly one day, and be a test for tour pros the next by essentially just quickening the greens. A new favorite of the USGA with a headquarters in town, Pinehurst #2 will host Opens again in 2029, 2035, 2041 and 2047.,Donald Ross; Bill Coore; Ben Crenshaw (2010 restoration),1907,Ross original. Coore/Crenshaw 2010 restoration removed Bermudagrass rough. Consecutive Men's and Women's U.S. Opens 2014.,U.S. Open 2014 (Men's and Women's), 2024 (Bryson DeChambeau); U.S. Opens 2029, 2035, 2041, 2047 (scheduled),,,,,USGA favorite with headquarters in town
33,33,,,San Francisco Golf Club,San Francisco,CA,Private,21,4.5,true,false,true,San Francisco Golf Club's original routing was done mostly by a trio of club members, who first staked out the course in 1918. A.W. Tillinghast remodeled the course in 1923, establishing its signature greens and bunkering. He also added the par-3 seventh, called the Duel Hole, because its location marks the spot of the last legal duel in America. Three holes were replaced in 1950 in anticipation of a street widening project that never happened. In 2006, the original holes were re-established by Tom Doak and his then-associate Jim Urbina.,A.W. Tillinghast; Tom Doak; Jim Urbina,1918,Original routing by club members 1918. Tillinghast remodel 1923. Famous Duel Hole par-3 seventh. Doak restored original holes 2006.,,,,,,Site of last legal duel in America
34,36,,,Ballyneal Golf Club,Holyoke,CO,Private,35,4.5,true,false,true,If Sand Hills Golf Club stands for the notion that there's nothing more glorious than a round of golf beyond the range of cell phone reception, then Ballyneal (Tom Doak's northeast Colorado answer to Nebraska's Sand Hills) proves that isolated golf is even better when spartan in nature. With no carts and dry, tan fescue turf on fairways and greens, Ballyneal is even more austere than Sand Hills. It provides absolute firm and fast conditions, and with many greens perched on hilltops, the effect of wind on putts must be considered. The rolling landforms, topsy-turvy greens and half-par holes make playing here feel like a joyride. That sense of exuberance has catapulted Ballyneal from an original ranking of 95th in 2011 to its highest ranking to date at 34th.,Tom Doak,2006,Opened 2006. Jumped from 95th (2011) to 34th. No carts, dry tan fescue. Colorado answer to Sand Hills.,,,,,,Catapulted from 95th to 34th ranking
35,35,olympic-club,The Olympic Club,The Olympic Club: Lake,San Francisco,CA,Private,35,5,true,false,true,It seems fitting that, in a town where every house is a cliffhanger, every U.S. Open played at Olympic has been one, too. For decades, the Lake was a severe test of golf. Once, it was a heavily forested course with canted fairways hampered by just a single fairway bunker. By 2009, the forest had been considerably cleared away, leaving only the occasional bowlegged cypress with knobby knees. The seventh and 18th greens were redesigned, and a new par-3 eighth added. Despite those changes, the 2012 U.S. Open stuck to the usual script: a ball got stuck in a tree, slow-play warnings were given, a leader snap-hooked a drive on 16 in the final round and a guy named Simpson won. If the past was predictable, the future of the Lake Course might be more mysterious after Gil Hanse and Jim Wagner completed a remodeling in 2023 in preparation for the 2028 PGA Championship. The holes are even more breathable than before, with additional tree decluttering, the greens have been expanded for more hole locations and the bunkers don't seem so deep and disconnected with the greens as they did. That old seventh hole was also scrapped in favor of a new drivable par-4 playing to a new greensite closer to the eighth tee. What hasn't changed is the Lake Course's secret ingredient, the mysterious hillside atmosphere that makes balls fall out of the air and the holes play much longer than their yardage.,Gil Hanse; Jim Wagner (2023 remodel),,Forest cleared by 2009. 7th and 18th greens redesigned, new par-3 8th added. Hanse/Wagner 2023 remodel for 2028 PGA.,U.S. Open 2012; PGA Championship 2028 (scheduled),,,,,Mysterious hillside atmosphere affects ball flight
36,34,,,Ohoopee Match Club,Cobbtown,GA,Private,15,5,true,false,true,From Golf Digest Architecture Editor emeritus Ron Whitten: I've been told Gil Hanse had first examined the site of Ohoopee Match Club as far back as 2006 considered it ideal for golf: gently rolling terrain with no severe elevation changes, and beautiful sandy soil deposited by the nearby Ohoopee River, perfect for drainage and firm, fast conditions. The ground around tiny Cobbtown, Ga., is also perfect for growing onions—it's just northeast of Vidalia, world-famous for the Vidalia onion. Indeed, Ohoopee's logo is a freshly picked onion, although if you look closely, its roots are three writhing snakes. Any symbolism pertaining to match play is uncertain; perhaps it simply suggests the sort of putts one will face. What's the composition of a course meant for match play? One might think it would contain lots of penal hazards, because a triple bogey on any particular hole would not be fatal in match play. Perhaps the targets would be smaller than normal, to level the playing field between big hitters and short-but-accurate golfers. That's not the composition of the 7,325-yard championship course at Ohoopee. Hanse did produce dramatic visuals in this sandy locale that hark back to portions of Pinehurst and Pine Valley, from long expanses of sandy rough dotted with native plants to deep, foreboding pits of sand, but they're mostly on the far perimeter of holes.,Gil Hanse,2006,Hanse examined site in 2006. Perfect sandy soil from Ohoopee River. Match play design with dramatic visuals. 7,325 yards.,,,,,,Logo is onion with snake roots; Vidalia onion region
37,38,,,The Alotian Club,Roland,AR,Private,11,4.5,true,false,true,The Alotian Club gives us a hint of what Augusta National would have looked like had Bobby Jones established his dream course on even hillier terrain than Augusta. The first tee shot drops 70 feet to a fairway below, with the approach playing back uphill. The tee on the 205-yard par-3 sixth sits 85 feet above the green. The Alotian Club, founded by Warren Stephens, son of former Masters chairman Jackson Stephens, is the first (and still only) course in Arkansas ever to make our list of America's 100 Greatest Golf Courses. The Alotian name comes from the annual golf trips Stephens once took with his buddies. He called it the America's Lights Out Tour, and participants called themselves The Alotians. In recent years, The Alotian Club has opened its doors to collegiate players—first for the 2019 Palmer Cup and since 2020, annually for the Stephens Cup.,Tom Fazio,,Founded by Warren Stephens. First Arkansas course in top 100. Named after America's Lights Out Tour (Alotians).,Palmer Cup 2019; Stephens Cup (annually since 2020),,,,,Hint of Augusta on hillier terrain
38,39,bethpage-state-park,Bethpage State Park,Bethpage State Park: Black,Farmingdale,NY,Public,41,4.5,true,true,true,Sprawling Bethpage Black, designed in the mid-1930s to be the public Pine Valley, became the darling of the USGA in the early 2000s, when it brought the 2002 and 2009 U.S. Opens here. Then it became a darling of the PGA Tour as host of the 2011 and 2016 Barclays. Now, the PGA of America has embraced The Black, which hosted the 2019 PGA Championship (winner: Brooks Koepka) and the upcoming 2025 Ryder Cup. Heady stuff for a layout that was once a scruffy state-park haunt where one needed to sleep in the parking lot in order to get a tee time. Now, you need fast fingers on the state park's website once tee times are available—as prime reservations at The Black are known for going in seconds.,A.W. Tillinghast,1930s,Designed mid-1930s as the public Pine Valley. USGA and PGA Tour favorite.,U.S. Open 2002, 2009; Barclays 2011, 2016; PGA Championship 2019 (Brooks Koepka); Ryder Cup 2025 (scheduled),,,,,Prime tee times go in seconds
39,54,,,Old Town Club,Winston Salem,NC,Private,27,5,true,false,true,Created by architect Perry Maxwell on the heels of his work at Prairie Dunes and Southern Hills, Old Town Club was surprisingly unique, and included perhaps Maxwell's only surviving double green. When Bill Coore and Ben Crenshaw were hired to address the bunkering at Old Town, they opted not to reproduce the original bunkers (some of which were enormous) but rather emulate their gnarly shapes, edges and vegetation in places where bunkers naturally fit. Lots of trees had already been removed, but the architects convinced the club to get rid of even more. Now, a single swath of fairway connects the seventh, eighth, ninth, 17th and 18th holes. Very unique. The course has jumped a remarkable 59 places in the rankings since it debuted in 2019.,Perry Maxwell; Bill Coore; Ben Crenshaw,,Maxwell's only surviving double green. Jumped 59 places since 2019 debut. Single fairway swath connects five holes.,,,,,,Jumped 59 places since 2019
40,42,,,Congaree Golf Club,Ridgeland,SC,Private,21,5,true,false,true,Tom Fazio has designed countless compelling golf courses on sites that weren't. But at Congaree, 30 minutes inland from Beaufort, S.C., he at least had great material: sand, in the form of two deep sections of it separated by a lowcountry wetland area. The sand made it easy to scoop and shape long ridgelines, creating significant movement across an otherwise level property—and dozens of stately live oaks, carefully transplanted for effect—further outline the design. Finely edged Melbourne-style bunkers sweep up to the edges of fairways and into greens, catching shots that drift too far and leading to challenging hi-lo recovery situations. Congaree hosted the 2022 CJ Cup after making its debut as a tour venue for the previous year's Palmetto Championship, which replaced that year's Canadian Open.,Tom Fazio,,30 minutes inland from Beaufort. Two deep sand sections separated by wetland. Stately live oaks transplanted.,CJ Cup 2022; Palmetto Championship 2021,,,,,Melbourne-style bunkers
41,41,tpc-sawgrass,TPC Sawgrass,TPC Sawgrass: Stadium,Ponte Vedra Beach,FL,Public,25,4.5,true,true,true,TPC's stadium concept was the idea of then-PGA Tour commissioner Deane Beman. The 1980 design was pure Pete Dye, who set out to test the world's best golfers by mixing the demands of distance with target golf. Most greens are ringed by random lumps, bumps and hollows, what Dye called his grenade attack architecture. His ultimate target hole is the heart-pounding sink-or-swim island green 17th, which offers no bailout, perhaps unfairly in windy Atlantic coast conditions. The 17th has spawned over a hundred imitation island greens in the past 40 years. To make the layout even more exciting during tournament play, Steve Wenzloff of PGA Tour Design Services later remodeled several holes, most significantly the 12th, which he turned into a drivable par-4, something Dye was never a fan of.,Pete Dye; Steve Wenzloff (remodel),1980,PGA Tour commissioner Deane Beman's stadium concept. Famous island green 17th. Wenzloff remodeled 12th to drivable par-4.,,,,,,Island green 17th spawned 100+ imitations
42,45,baltusrol-gc,Baltusrol Golf Club,Baltusrol Golf Club: Lower,Springfield,NJ,Private,31,4.5,true,false,true,Jack Nicklaus won two U.S. Opens on Baltusrol's Lower Course, setting a tournament record each time. Phil Mickelson and Jimmy Walker won PGAs on it. But the Lower's most historic event was the ace by architect Robert Trent Jones in 1954 on the par-3 fourth, instantly squelching complaints of critical club members who felt Trent's redesign made it too hard. Trent's younger son, Rees, an avowed A.W. Tillinghast fan, lightly retouched the Lower's design for the 2016 PGA Championship. But there has been another changing of the guard at Baltusrol, as architect Gil Hanse and his team took over as the club's new consulting architects, and re-opened the restored Lower course—after carefully examining Tilly's old plans and reclaiming green sizes and rebuilding bunkers—in May 2021. Hanse's team performed a similar restoration on Baltusrol's Upper course, which reopened in May 2025.,A.W. Tillinghast; Robert Trent Jones; Rees Jones; Gil Hanse (2021 restoration),,RTJ ace on par-3 fourth (1954). Hanse restored Lower (2021) and Upper (2025) courses.,U.S. Open (Jack Nicklaus, 2 wins); PGA Championship (Phil Mickelson, Jimmy Walker); PGA Championship 2016,,,,,Tillinghast original, RTJ and Rees Jones redesigns
43,37,,,Gozzer Ranch Golf and Lake Club,Harrison,ID,Private,17,5,true,false,true,When it won in 2008, Gozzer Ranch was the 13th Best New Course triumph for architect Tom Fazio. Gozzer won in part because of its gorgeous views of Lake Coeur d'Alene to the north and west, and the panoramic farm valley to the east. Little details elevate the architecture of Gozzer Ranch: a slight false-right-front edge on the first green, the backboard slope behind the sixth green, the fairway contouring on the dual-fairway drivable par-4 12th that kicks even a short drive to the base of the putting surface. Its shaggy-edged bunkers are more than mere set decorations. Some define targets off the tee; others pose options and challenges.,Tom Fazio,2008,13th Best New Course win for Fazio in 2008. Gorgeous views of Lake Coeur d'Alene.,,,,,,Dual-fairway drivable par-4 12th
44,40,bandon-dunes-resort,Bandon Dunes Resort,Bandon Dunes,Bandon,OR,Public,54,5,true,true,true,Chicago recycled-products mogul Mike Keiser took a gamble when he chose then-tenderfoot architect David McLay Kidd to design a destination daily fee on the remote southwestern coastline of Oregon. But the design Kidd produced, faithful to the links-golf tenets of his native Scotland, proved so popular that today Keiser has a multiple-course resort at Bandon Dunes that rivals Pinehurst and the Monterey Peninsula—or perhaps exceeds them, given that all five Bandon courses are ranked on our 200 Greatest, four in the top 100. None of that would have happened if McLay Kidd hadn't produced a great first design that drew golfers into its orbit.,David McLay Kidd,,First course at Bandon Dunes Resort. All five Bandon courses ranked in 200 Greatest, four in top 100.,,,,,,Links-golf faithful to Scotland tenets
45,61,winged-foot-gc,Winged Foot Golf Club,Winged Foot Golf Club: East,Mamaroneck,NY,Private,19,4.5,true,false,true,Winged Foot's two-course complex is the product of A.W. Tillinghast's fertile imagination. Every characteristic of the more famous West Course also exists on the Winged Foot East (which, incredibly, was used as a parking lot during recent U.S. Opens). A decade ago, architect Gil Hanse re-established Tillinghast's bunkering and reclaimed the original sizes and shapes of the greens, bringing corner-pocket hole locations back into play. Many members believe the East Course is just as strong a design—if not better—than the West.,A.W. Tillinghast; Gil Hanse (restoration),,Tillinghast two-course complex. Used as parking lot during recent U.S. Opens. Hanse restored bunkering and greens.,,,,,,Members believe equal or better than West
46,44,,,The Golf Club,New Albany,OH,Private,18,4.5,true,false,true,The Golf Club, built in 1966, may be the most authentic of Pete Dye's transition period of design, when he first chose to buck convention and start building lay-of-the-land layouts like those he'd seen during a 1963 tour of Scotland. In doing so, Dye reintroduced deception, misdirection and railroad ties into American golf architecture. Its construction attracted the attention of local boy Jack Nicklaus, who visited several times and made some astute suggestions. That led to a five-year Dye-Nicklaus design partnership. The Golf Club remained untouched for nearly 45 years, until Pete Dye returned in 2014 to rebuild holes, modestly adjusting some of his original green contours to better match present-day green speeds. He also relocated the fifth green, adding a contorted putting surface more reminiscent of his later designs, an inconspicuous reminder of how much his design predilections evolved throughout his career.,Pete Dye; Jack Nicklaus (suggestions),1966,Dye's transition period (1966). Led to five-year Dye-Nicklaus partnership. Dye returned 2014 to adjust for modern green speeds.,,,,,,Reintroduced deception and railroad ties
