usRanking,previousRank,clubId,clubName,name,city,state,courseType,panelistCount,starRating,in100Greatest,in100GreatestPublic,bestInState,description,designers,yearOpened,notableHistory,majorTournaments,address,phone,website,par,yardage,notes
1,1,,,Pine Valley Golf Club,Pine Valley,NJ,Private,19,5,true,false,true,A genuine original, its unique character is forged from the sandy pine barrens of southwest Jersey. Founder George Crump had help from now-legendary architects H.S. Colt, A.W. Tillinghast, George C. Thomas Jr. and Walter Travis. Hugh Wilson (of Merion fame) and his brother Alan finished the job, while William Flynn and Perry Maxwell made revisions. Throughout the course, Pine Valley blends all three schools of golf design—penal, heroic and strategic—often times on a single hole. Recent tree removal at selected spots has revealed some gorgeous views of the sandy landscape upon which the course is routed, and Tom Fazio has put his own touch on the design with bunker remodels that have given the barrens a more intricate and ornate look.,George Crump; H.S. Colt; A.W. Tillinghast; George C. Thomas Jr.; Walter Travis; Hugh Wilson; Alan Wilson; William Flynn; Perry Maxwell; Tom Fazio (renovation),,Founded by George Crump with collaboration from legendary architects. Hugh and Alan Wilson finished the job. Recent tree removal and Tom Fazio bunker remodels.,,,,,,Source: Golf Digest America's 100 Greatest Golf Courses
2,2,,,Augusta National Golf Club,Augusta,GA,Private,12,5,true,false,true,No club has tinkered with its golf course as often or as effectively over the decades as has Augusta National Golf Club, mainly to keep it competitive for the annual Masters Tournament, an event it has conducted since 1934, with time off during WWII. All that tinkering has resulted in an amalgamation of design ideas, with a routing by Alister Mackenzie and Bobby Jones, some Perry Maxwell greens, some Trent Jones water hazards, some Jack Nicklaus mounds and swales and, most recently, extensive rebunkering and tree planting by Tom Fazio. The tinkering continues, including the lengthening of the par-4 fifth in the summer of 2018, the lengthening of the 11th and 15th holes in 2022, and the addition of 35 yards to the famed par-5 13th in 2023.,Alister Mackenzie; Bobby Jones; Perry Maxwell; Trent Jones; Jack Nicklaus; Tom Fazio,1934,Hosts the annual Masters Tournament since 1934 (except during WWII). Continuous modifications to maintain competitiveness for the tournament.,The Masters (annually since 1934),,,,,Continuous course evolution by multiple legendary architects
3,3,,,Cypress Point Club,Pebble Beach,CA,Private,27,5,true,false,true,From Golf Digest Architecture Editor emeritus Ron Whitten: Cypress Point, the sublime Monterey Peninsula work of sandbox sculpture, whittled Cypress and chiseled coastline, has become Exhibit A in the argument that classic architecture has been rendered ineffectual by modern technology. I'm not buying that argument. Those who think teeny old Cypress Point is defenseless miss the point of Alister MacKenzie's marvelous design. MacKenzie relished the idea that Cypress Point would offer all sorts of ways to play every hole. That philosophy still thrives, particularly in the past decade, after the faithful restoration of MacKenzie's original bunkers by veteran course superintendent Jeff Markow.,Alister MacKenzie,,Restoration of MacKenzie's original bunkers by Jeff Markow. Located on Monterey Peninsula with dramatic coastline.,,,,,,
4,4,,,Shinnecock Hills Golf Club,Southampton,NY,Private,11,5,true,false,true,Generally considered to be the earliest links in America, heavily remodeled by C.B. Macdonald, then replaced (except for three holes) by William S. Flynn in the early 1930s, it's so sublime that its architecture hasn't really been altered for nearly 60 years. Stands of trees that once framed many holes have been removed, and in 2012, the team of Bill Coore and Ben Crenshaw did make a few changes, mostly greens and fairways expansions and new mowing patterns, though those were modified in preparation for the 2018 U.S. Open, won by Brooks Koepka. Shinnecock will again host the U.S. Open in 2026.,C.B. Macdonald; William S. Flynn; Bill Coore; Ben Crenshaw (2012 modifications),1930s,One of America's earliest links courses. 2012 modifications by Coore & Crenshaw. 2018 modifications for U.S. Open.,U.S. Open 2018 (Brooks Koepka); U.S. Open 2026 (scheduled),,,,,Architecture largely unchanged for 60 years
5,5,,,Oakmont Country Club,Oakmont,PA,Private,25,5,true,false,true,Once tens of thousands of trees were removed between the early 1990s and 2015 (most planted in the 1960s), Oakmont's original penal design was re-established, with the game's nastiest, most notorious bunkers (founder-architect H.C. Fownes staked out bunkers whenever and where ever he saw a player hit an offline shot), deep drainage ditches and ankle-deep rough. Oakmont also has the game's swiftest putting surfaces, which were showcased during the U.S. Open in 2016, despite early rains that slowed them down a bit. Gil Hanse and Jim Wagner made bunker modifications and expanded the greens throughout the course in 2023 in preparation for the 2025 U.S. Open. The USGA has already awarded Oakmont three additional Opens between 2033 and 2049, reinforcing its title as the Host of the Most U.S. Opens ever.,H.C. Fownes; Gil Hanse; Jim Wagner (2023 modifications),1900s,Tree removal program (1990s-2015) restored original penal design. Known for notorious bunkers and fastest putting surfaces. 2023 modifications for 2025 U.S. Open.,U.S. Open 2016; U.S. Open 2025 (scheduled); U.S. Opens 2033, 2040s, 2049 (scheduled),,,,,Host of the Most U.S. Opens ever
6,6,merion-gc,Merion Golf Club,Merion Golf Club: East,Ardmore,PA,Private,28,5,true,false,true,Merion East has long been considered the best course on the tightest acreage in America, and when it hosted the U.S. Open in 2013, its first since 1981, the present generation of big hitters couldn't conquer this clever little course. They couldn't consistently hit its twisting fairways, which are edged by creeks, hodge-podge rough and OB stakes. Additionally, players couldn't consistently hold its canted greens, edged by bunkers that stare back. Justin Rose won with a 72-hole total of one-over-par, two ahead of Jason Day and Phil Mickelson. With Gil Hanse's extensive two-year renovation after that tournament, making even more improvements at Merion's East Course, the design should be even more polished and pristine when the U.S. Amateur returns in 2026 and the U.S. Open returns again in 2030.,Hugh Wilson (original); Gil Hanse (renovation),1912,Best course on tightest acreage in America. Gil Hanse's extensive two-year renovation post-2013.,U.S. Open 2013 (Justin Rose); U.S. Amateur 2026 (scheduled); U.S. Open 2030 (scheduled),,,,,Known for tight, strategic design
7,7,,,National Golf Links of America,Southampton,NY,Private,23,5,true,false,true,This is where golf architect Seth Raynor got his start. A civil engineer by training, he surveyed holes for architect C.B. Macdonald, who scientifically designed National Golf Links as a fusion of his favorite features from grand old British golf holes. National Golf Links is a true links containing a marvelous collection of holes. As the 2013 Walker Cup reminded us, Macdonald's versions are actually superior in strategy to the originals, which is why National's design is still studied by golf architects today, its holes now replicated elsewhere. Hard to fathom that National Golf Links of America was not ranked among America's 100 Greatest Golf Courses from 1969 until 1985. Theories involve possible hazy, rough around the edges conditions during the 1970s that dulled the architecture (something that didn't impact over-the-fence Shinnecock Hills), the course's relatively short length that didn't meet the era's championship course standards, or simply that the unique Macdonald shapes and concepts were too quirky for the prevailing tastes of the era. No matter now. National is rightly positioned as one of America's most original and influential expressions of golf course architecture.,C.B. Macdonald; Seth Raynor,1900s,Where Seth Raynor got his start. Template holes based on British classics. Not ranked in top 100 from 1969-1985.,Walker Cup 2013,,,,,Original and influential architecture
8,8,,,Sand Hills Golf Club,Mullen,NE,Private,19,5,true,false,true,The golf course wasn't so much designed as discovered. Bill Coore and Ben Crenshaw trudged back and forth over a thousand acres of rolling sand hills in central Nebraska, flagging out naturally occurring fairways and greens. By moving just 4,000 cubic yards of earth and letting the winds shape the bunkers, the duo created what is undoubtedly the most natural golf course in America—a timeless course design. For decades, winter winds had always reshaped the bunkers, but course officials have recently discovered a method to prevent that. At the close of the season, they spray the surface of the sand in bunkers with a product that creates a crust to resist the howling winds.,Bill Coore; Ben Crenshaw,1990s,Minimalist design with only 4,000 cubic yards of earth moved. Natural sand hills discovery. Innovation in bunker preservation.,,,,,,Most natural golf course in America
9,12,,,Pebble Beach Golf Links,Pebble Beach,CA,Public,46,5,true,true,true,Not just the greatest meeting of land and sea in American golf, but the most extensive one, too, with nine holes perched immediately above the crashing Pacific surf—the fourth through 10th plus the 17th and 18th. Pebble's sixth through eighth are golf's real Amen Corner, with a few Hail Marys thrown in over an ocean cove on the eighth from atop a 75-foot-high bluff. Pebble hosted a successful U.S. Amateur in 2018 and a sixth U.S. Open in 2019. Recent improvements include the redesign of the once-treacherous 14th green and reshaping the par-3 17th green, both planned by Arnold Palmer's Design Company a few years back, and modifications to the green at the famous eighth hole, which we deemed the second Greatest Hole in America. Green modifications have continued, and Pebble re-enters our top 10 after a brief time out the last two years.,Arnold Palmer's Design Company (modifications),1919,Hosted U.S. Amateur 2018 and sixth U.S. Open 2019. Famous eighth hole (second Greatest Hole in America). Recent green modifications and redesigns.,U.S. Amateur 2018; U.S. Open 2019,,,,,Public access course
10,9,,,Fishers Island Club,Fishers Island,NY,Private,24,5,true,false,true,Undoubtedly, Fishers Island Club is the most dazzling design by architect Seth Raynor, who died in early 1926 before the course had officially opened. His steeply banked bunkers and geometric greens harmonize perfectly with the linear panoramas of the Atlantic Ocean and Long Island Sound. The quality of the holes is also superb, with all Raynor's usual suspects, including not one but two Redan greens, one on a par-4. The setting on a private island accessible only by ferry adds to the mystique, and three holes (four, five and nine) appear on our ranking of America's 100 Greatest Holes.,Seth Raynor,1926,Seth Raynor died before official opening. Private island accessible only by ferry. Three holes in America's 100 Greatest Holes (4, 5, 9).,,,,,,Template holes including two Redan greens
11,13,,,Chicago Golf Club,Wheaton,IL,Private,21,5,true,false,true,Chicago Golf Club opened the country's first 18-hole course in 1893, built by C.B. Macdonald, the preeminent golf expert in the U.S. at the time. Two years later, Macdonald built the club a different course after the membership moved to a new location in Wheaton, Ill.: a really first-class 18-hole course of 6,200 yards, he wrote. Members played that course until 1923 when Seth Raynor, who began his architectural career as Macdonald's surveyor and engineer, redesigned it using the ideal hole concepts his old boss had developed 15 years earlier (he kept Macdonald's routing, which placed all the O.B. on the left—C.B. sliced the ball). For reasons of history and practicality, no major remodels have occurred since then, allowing the club to merely burnish the architecture by occasionally upgrading worn parts, adjusting grassing lines, and recently, reestablishing a number of lost bunkers that had been filled in over time.,C.B. Macdonald; Seth Raynor,1893,First 18-hole course in America (1893). Redesigned by Seth Raynor in 1923 using ideal hole concepts. No major remodels since 1923.,,,,,,
12,10,,,Seminole Golf Club,Juno Beach,FL,Private,23,5,true,false,true,A majestic Donald Ross design with a clever routing on a rectangular site, each hole at Seminole encounters a new wind direction. The routing is perhaps the only thing that remains of Ross' vision. The greens are no longer his, replaced 60 years ago in a regrassing effort that showed little appreciation for the original rolling contours. The bunkers aren't Ross either. Dick Wilson replaced them in 1947, his own version meant to imitate crests of waves on the adjacent Atlantic. A few years back, Bill Coore and Ben Crenshaw redesigned the bunkers again, set lower, closer to the way Ross had them, along with exposing sandy expanses in the rough. The club is about to embark on another major remodel by Gil Hanse and Jim Wagner intended to finally recreate Ross' internal green movements based on his blueprints and elevate sections of the course to remediate drainage concerns. Seminole has long been one of America's most exclusive clubs, which is why it was thrilling to see it on TV for a first time during the TaylorMade Driving Relief match, and then again for the 2021 Walker Cup.,Donald Ross; Dick Wilson; Bill Coore; Ben Crenshaw; Gil Hanse; Jim Wagner (upcoming remodel),,Donald Ross original design. Greens replaced 60 years ago. Dick Wilson bunkers (1947). Coore & Crenshaw redesign. Upcoming Hanse/Wagner remodel.,Walker Cup 2021,,,,,Hosted TaylorMade Driving Relief match
13,11,winged-foot-gc,Winged Foot Golf Club,Winged Foot Golf Club: West,Mamaroneck,NY,Private,30,5,true,false,true,Gone are all the Norway Spruce that once squeezed every fairway of Winged Foot West. It's now gloriously open and playable, at least until one reaches the putting surfaces, perhaps the finest set of green contours the versatile architect A.W. Tillinghast ever did, now restored to original parameters by architect Gil Hanse. The greens look like giant mushrooms, curled and slumped around the edges, proving that as a course architect, Tillinghast was not a fun guy. Winged Foot West was tamed, somewhat, by Bryson DeChambeau in winning the 2020 U.S. Open that was played in September, but he was the only competitor to finish under par in his six-shot victory.,A.W. Tillinghast; Gil Hanse (restoration),,Norway Spruce trees removed opening up fairways. Gil Hanse restored greens to original parameters.,U.S. Open 2020 (Bryson DeChambeau),,,,,Tillinghast's finest green contours
14,15,,,Friar's Head Golf Club,Riverhead,NY,Private,19,5,true,false,true,The challenge for architects Bill Coore and Ben Crenshaw at Friar's Head was to design some holes in breathtaking sand dunes perched 200 feet above Long Island Sound, and other holes on an ordinary potato field to the south. Said Crenshaw, Our job was to marry the two distinct elements. We didn't want one nine up in the dunes and the other down on the flat. The solution was to move the routing back and forth and to artfully reshape the farm fields into gentle links-like land. They pulled it off so impressively that Friar's Head has moved up the rankings each survey period since its debut at 34th in 2011 to 14th this year.,Bill Coore; Ben Crenshaw,2011,Opened in 2011 at 34th rank, moved up to 14th. Dunes 200 feet above Long Island Sound married with potato fields.,,,,,,Moved up rankings every survey since 2011
15,14,,,Crystal Downs Country Club,Frankfort,MI,Private,27,5,true,false,true,Perry Maxwell, the Midwest associate of architect Alister MacKenzie, lived on site while constructing the course to MacKenzie's plans, but there's evidence Maxwell exercised considerable artistic license on some holes. Whomever did it, Crystal Downs has fairways that zigzag and rumble over the glacial landscape and greens that have doglegs in them. One drawback is that the putting surfaces are so old-fashioned that they're too steep for today's green speeds. But that's part of Crystal Downs' appeal. It's short but has considerable bite.,Alister MacKenzie; Perry Maxwell,,Perry Maxwell lived on-site during construction. Evidence of artistic license on some holes.,,,,,,Short course with considerable bite
16,16,los-angeles-cc,Los Angeles Country Club,Los Angeles Country Club: North,Los Angeles,CA,Private,21,5,true,false,true,It's on the edge of Tinsel Town, but the architecture of the North Course at Los Angeles Country Club has been solid gold ever since its 2010 restoration by architect Gil Hanse and partner Jim Wagner. It matters not that Hanse's team didn't replicate the bunkering style of original architect George C. Thomas, but rather the more visually exciting style of Thomas' associate, William P. Bell. The first nine plays rustically up and down a shallow canyon with holes switching back and forth across a dry barranca, and the second nine loops across a more spacious upland section with one par 3 (the 11th) that can stretch to nearly 300 yards and another (the 15th) that often plays just 90 yards. The hole strategies reinstituted by Hanse provided an intriguing examination when LACC's North course hosted the 2023 U.S. Open as Wyndham Clark beat Rory McIlroy by a stroke.,George C. Thomas; William P. Bell; Gil Hanse; Jim Wagner (2010 restoration),,2010 restoration by Gil Hanse and Jim Wagner. Replicated William P. Bell's bunkering style rather than Thomas's.,U.S. Open 2023 (Wyndham Clark),,,,,On the edge of Tinsel Town
17,19,the-country-club,The Country Club,The Country Club: The Main Course,Brookline,MA,Private,2,4.5,true,false,true,The Country Club's 18-hole course, which was the scene of the 1963 and 1988 U.S. Opens, is not the 18-hole course ranked by Golf Digest. Those events were played on a composite course that utilizes several holes from the club's third nine, Primrose, designed by William Flynn. We rank the combination of the Main Course (the Clyde and Squirrel nines), clearly good enough to be one of the top courses in the world. Gil Hanse performed some course restoration prior to the 2013 U.S. Amateur at The Country Club and again before the 2022 U.S. Open, won by Matthew Fitzpatrick. The USGA used a new configuration of 18 holes for that championship, eliminating the par-4 fourth and adding the tiny, downhill par-3 11th to the mix, the first time the hole was used since the 1913 Open won by Francis Ouimet.,William Flynn; Gil Hanse (restoration),,Gil Hanse restoration before 2013 U.S. Amateur and 2022 U.S. Open. New hole configuration for 2022 championship.,U.S. Open 1963, 1988, 2022 (Matthew Fitzpatrick); U.S. Amateur 2013; U.S. Open 1913 (Francis Ouimet),,,,,Composite course uses holes from Primrose nine
18,18,,,Riviera Country Club,Pacific Palisades,CA,Private,28,5,true,false,true,A compact and shrewd design by George C. Thomas Jr. and associate William P. Bell, Riviera features everything from a long Redan par-3 to a bunker in the middle of a green to an alternate-fairway par-4. With its 18th green at the base of a natural amphitheater, and its primary rough consisting of club-grabbing Kikuyu, Riviera seems tailor-made as a tournament venue. It hosted a PGA Championship in 1995, a U.S. Senior Open in 1998 and a U.S. Amateur in 2017, but no U.S. Open since 1948. Riviera was recently awarded the 2031 U.S. Open, and it will also host the 2028 Olympics. But it's the site of an annual PGA Tour event, which is even better exposure to the golf world.,George C. Thomas Jr.; William P. Bell,,Hosted PGA Championship 1995, U.S. Senior Open 1998, U.S. Amateur 2017. Awarded 2031 U.S. Open.,PGA Championship 1995; U.S. Senior Open 1998; U.S. Amateur 2017; U.S. Open 2031 (scheduled); Olympics 2028 (scheduled),,,,,Annual PGA Tour event host
19,17,,,Muirfield Village Golf Club,Dublin,OH,Private,23,5,true,false,true,This is the course that Jack built, and rebuilt, and rebuilt again and again. Since its opening in 1974, Jack Nicklaus has remodeled every hole at Muirfield Village, some more than once, using play at the PGA Tour's annual Memorial Tournament for some guidance. The renovation in 2020 was one of the most extensive and included the rebuilding of every hole, the shifting of greens and tees, strategic changes to the iconic par 5s and a new, more player-friendly par-3 16th, though that hole, too, has been tweaked since. That's how a championship course remains competitive. But with every change, Nicklaus always made sure the general membership could still play and enjoy the course.,Jack Nicklaus,1974,Jack Nicklaus designed and continuously remodeled. 2020 renovation was most extensive. Uses Memorial Tournament for guidance.,,,,,,Championship course remains competitive through evolution
20,20,oakland-hills-cc,Oakland Hills Country Club,Oakland Hills Country Club: South Course,Bloomfield Hills,MI,Private,54,5,true,false,true,Donald Ross felt his 1918 design was out of date for the 1951 U.S. Open and was prepared to remodel it. Sadly, he died in 1948, so Robert Trent Jones got the job. His rebunkering was overshadowed by ankle-deep rough, and after Ben Hogan closed with a 67, one of only two rounds under par-70 all week, to win his second consecutive Open, he complained that Jones had created a Frankenstein. Seventy-plus years later, Oakland Hills is even longer, but its bite wasn't severe when it hosted the 2016 U.S. Amateur. In 2019, the South course closed as Gil Hanse and his team significantly renovated the course with the intention of removing the Jones-era influences and restoring its Ross feel. They did that by expanding greens to recapture what are some of Ross's best contours, removing trees to show off the rolling landscape and shifting bunkers back to where Ross, not RTJ (or RTJ's son Rees, during previous remodels), placed them. The course re-opened in Spring 2021, and though a crippling fire destroyed the club's iconic clubhouse, the USGA delivered some kind news to the club, bringing the 2034 and 2051 U.S. Opens to Oakland Hills—as well as a number of upcoming USGA championships.,Donald Ross; Robert Trent Jones; Gil Hanse (2019 renovation),1918,Ross original (1918), died before 1951 remodel. RTJ rebunkering for 1951 U.S. Open. Hanse 2019 renovation restored Ross feel. Reopened 2021.,U.S. Open 1951 (Ben Hogan); U.S. Amateur 2016; U.S. Opens 2034, 2051 (scheduled),,,,,Clubhouse destroyed by fire, rebuilt
21,22,oak-hill-cc,Oak Hill Country Club,Oak Hill Country Club: East,Rochester,NY,Private,27,5,true,false,true,Back in 1979, George Fazio and nephew Tom were roundly criticized by Donald Ross fans for removing a classic Ross par-4 on Oak Hill East and replacing it with two new holes, including the bowl-shaped par-3 sixth, which would later become the scene of four aces in two hours during the second round of the 1989 U.S. Open. They also built a pond on another par-3 and relocated the green on the par-4 18th. The club hired golf architect Andrew Green to remodel those holes to bring them more in line with Donald Ross' original style. In addition to putting the final touches (at least for now) on a significant tree removal program, Green re-established Ross' original par-4 hole, then the fifth and now playing as the sixth (pictured here). Reconstruction occurred after the 2019 Senior PGA Championship on the East Course and was completed in May 2020. Oak Hill's East Course hosted the 2023 PGA Championship, won by Brooks Koepka.,Donald Ross; George Fazio; Tom Fazio; Andrew Green (remodel),1926,Ross original. 1979 Fazio remodel criticized. Andrew Green restored Ross style. Reconstruction completed May 2020.,U.S. Open 1989; Senior PGA Championship 2019; PGA Championship 2023 (Brooks Koepka),,,,,Famous bowl-shaped par-3 sixth (four aces in 1989)
22,25,,,Peachtree Golf Club,Atlanta,GA,Private,54,5,true,false,true,The design collaboration by amateur star Bobby Jones and golf architect Robert Trent Jones (no relation) was meant to recapture the magic that the Grand Slam winner had experienced when he teamed with Alister Mackenzie in the design of Augusta National. But Trent was an even more forceful personality than the flamboyant MacKenzie, so Peachtree reflects far more of Trent's notions of golf than Bobby's, particularly in designing for future equipment advances. When it opened, Peachtree measured in excess of 7,200 yards, extremely long for that era. It boasted the longest set of tees in America (to provide flexibility on holes) and the country's most enormous greens (to spread out wear and tear). As it turns out, Trent was a visionary, and decades later, other designers followed his lead to address advances in club and ball technology.,Bobby Jones; Robert Trent Jones,,Collaboration between Bobby Jones and Robert Trent Jones. 7,200+ yards when opened. Longest tees and largest greens in America at the time.,,,,,,RTJ visionary design for future equipment
